{
  "id": "KEDB-0003",
  "title": "Pod OOMKilled due to undersized memory limits",
  "category": "K8S_CAPACITY",
  "teams": [
    "Antuit CloudOps"
  ],
  "symptoms": [
    "Pod status OOMKilled with exit code 137",
    "Intermittent 502/503 from service during pod restarts",
    "Datadog memory utilization at 100% before kill",
    "CrashLoopBackOff after repeated OOM kills"
  ],
  "root_cause": "Memory limits set below actual working set; no VPA recommendations applied; memory leak in application (less common)",
  "workaround": "Temporarily increase memory limit via kubectl patch or Helm values override; scale replicas to distribute load",
  "permanent_fix": "Deploy VPA in recommendation mode; right-size limits based on P99 usage + 20% headroom; add memory leak detection in APM; update Helm chart defaults",
  "runbook_ref": "runbooks/rb-kedb-0003.md",
  "runbook_type": "hybrid",
  "auto_healing": {
    "mechanism": "VPA auto mode (with approval gate) or Karpenter node provisioning for memory-constrained scheduling",
    "tool": "VPA + Karpenter/cluster-autoscaler",
    "status": "planned"
  },
  "related_jira": [],
  "related_monitors": [
    "Pod OOMKilled",
    "Memory utilization > 90%"
  ],
  "frequency": "Validate after data pull",
  "status": "template",
  "owner": "CloudOps SRE",
  "last_reviewed": "2026-08-23",
  "notes": "Correlate with namespace-level resource quota reviews"
}
